{
  "result_version": 1,
  "task_id": "tsk_wf001_t1_a1",
  "attempt": 1,
  "status": "COMPLETED",
  "exit_code": 0,
  "duration_sec": 412,
  "cases": { "total": 38, "passed": 38, "failed": 0, "skipped": 0, "failures": [] },
  "signatures_hit": [],
  "metrics": { "latency_ms_p50": 12.4, "latency_ms_p99": 18.9, "peak_rss_mb": 214, "model_load_ms": 830 },
  "environment": { "serial": "R5CT10XXXXX", "soc": "QCM6125", "android": "12" },
  "artifact": { "commit": "a1b2c3d4e5f60718293a4b5c6d7e8f9012345678", "pipeline_id": 4321 },
  "attachments": [
    {
      "name": "logcat.txt",
      "object_key": "runs/wf001/t1/1/logcat.txt",
      "sha256": "0f1e2d3c4b5a69788796a5b4c3d2e1f00f1e2d3c4b5a69788796a5b4c3d2e1f0",
      "size": 183422
    }
  ]
}
